{"$schema":"https://json-schema.org/draft/2020-12/schema","$id":"knowledge/days-of-nature-color-faq-1391-core-eleven-fact-snapshot.schema.json","type":"object","additionalProperties":false,"required":["snapshot_format","snapshot_id","source_id","source_url","retrieved_at","capture_policy","facts","non_claims"],"properties":{"snapshot_format":{"const":"fact_limited_official_support_snapshot_v1"},"snapshot_id":{"const":"tgc_faq_1391_days_of_nature_color_core_eleven_2026_08_17"},"source_id":{"const":"source_tgc_faq_1391_days_of_nature_color_core_eleven"},"source_url":{"const":"https://thatgamecompany.helpshift.com/hc/en/17-sky-children-of-the-light/faq/1391-patch-notes---april-17-2025---0-29-0-319554-android-huawei-ios-playstation-steam-switch/"},"retrieved_at":{"const":"2026-08-17"},"capture_policy":{"type":"string","minLength":1},"facts":{"type":"object","additionalProperties":false,"required":["days_of_nature_window_start_date","days_of_nature_window_duration","days_of_color_window_start_date","days_of_color_window_duration","exact_price_items","ticket_identity_items"],"properties":{"days_of_nature_window_start_date":{"const":"2025-04-28"},"days_of_nature_window_duration":{"const":"3 weeks"},"days_of_color_window_start_date":{"const":"2025-05-26"},"days_of_color_window_duration":{"const":"2 weeks"},"exact_price_items":{"minItems":7,"maxItems":7,"const":[{"item_id":"item_days_of_nature_ocean_necklace","official_name_en":"Ocean Necklace","original_currency":"USD","original_cost":1.99,"event":"days_of_nature"},{"item_id":"item_days_of_nature_sonorous_seashell","official_name_en":"Nature Sonorous Seashell","original_currency":"USD","original_cost":4.99,"event":"days_of_nature"},{"item_id":"item_days_of_nature_earth_cape","official_name_en":"Earth Cape","original_currency":"USD","original_cost":4.99,"event":"days_of_nature"},{"item_id":"item_days_of_nature_ocean_cape","official_name_en":"Ocean Cape","original_currency":"USD","original_cost":14.99,"event":"days_of_nature"},{"item_id":"item_days_of_color_rainbow_ribbon_shawl","official_name_en":"Rainbow Ribbon Shawl","original_currency":"USD","original_cost":14.99,"event":"days_of_color"},{"item_id":"item_days_of_color_rainbow_face_paint_mask","official_name_en":"Rainbow Face Paint mask","original_currency":"USD","original_cost":19.99,"event":"days_of_color"},{"item_id":"item_days_of_color_dark_rainbow_loafers","official_name_en":"Dark Rainbow Loafers","original_currency":"USD","original_cost":19.99,"event":"days_of_color"}]},"ticket_identity_items":{"minItems":4,"maxItems":4,"const":[{"item_id":"item_days_of_nature_ocean_waves_outfit","official_name_en":"Ocean Waves outfit","original_currency":"event_currency","original_cost":"unknown","event":"days_of_nature"},{"item_id":"item_days_of_nature_ocean_manta_hair","official_name_en":"Ocean Manta hair","original_currency":"event_currency","original_cost":"unknown","event":"days_of_nature"},{"item_id":"item_days_of_color_rainbow_smock","official_name_en":"Rainbow Smock","original_currency":"event_currency","original_cost":"unknown","event":"days_of_color"},{"item_id":"item_days_of_color_rainbow_head_wrap","official_name_en":"Rainbow Head Wrap","original_currency":"event_currency","original_cost":"unknown","event":"days_of_color"}]}}},"non_claims":{"type":"array","minItems":1,"items":{"type":"string","minLength":1}}}}
