{
  "snapshot_format":"fact_limited_official_support_snapshot_v1",
  "snapshot_id":"tgc_faq_1391_days_of_nature_color_core_eleven_2026_08_17",
  "source_id":"source_tgc_faq_1391_days_of_nature_color_core_eleven",
  "source_url":"https://thatgamecompany.helpshift.com/hc/en/17-sky-children-of-the-light/faq/1391-patch-notes---april-17-2025---0-29-0-319554-android-huawei-ios-playstation-steam-switch/",
  "retrieved_at":"2026-08-17",
  "capture_policy":"Structured, fact-limited transcription of FAQ 1391's starts, stated durations, seven exact-price single-item offers, and four named event-ticket unlock entries without an asserted ticket count. Official spelling and capitalization are preserved; any vendor-title reconciliation is explicitly enumerated by the apply contract. Ocean Waves Mask has no exact vendor identity in the pinned snapshot and is excluded. All packs and bundles are deliberately excluded.",
  "facts":{
    "days_of_nature_window_start_date":"2025-04-28",
    "days_of_nature_window_duration":"3 weeks",
    "days_of_color_window_start_date":"2025-05-26",
    "days_of_color_window_duration":"2 weeks",
    "exact_price_items":[
      {"item_id":"item_days_of_nature_ocean_necklace","official_name_en":"Ocean Necklace","original_currency":"USD","original_cost":1.99,"event":"days_of_nature"},
      {"item_id":"item_days_of_nature_sonorous_seashell","official_name_en":"Nature Sonorous Seashell","original_currency":"USD","original_cost":4.99,"event":"days_of_nature"},
      {"item_id":"item_days_of_nature_earth_cape","official_name_en":"Earth Cape","original_currency":"USD","original_cost":4.99,"event":"days_of_nature"},
      {"item_id":"item_days_of_nature_ocean_cape","official_name_en":"Ocean Cape","original_currency":"USD","original_cost":14.99,"event":"days_of_nature"},
      {"item_id":"item_days_of_color_rainbow_ribbon_shawl","official_name_en":"Rainbow Ribbon Shawl","original_currency":"USD","original_cost":14.99,"event":"days_of_color"},
      {"item_id":"item_days_of_color_rainbow_face_paint_mask","official_name_en":"Rainbow Face Paint mask","original_currency":"USD","original_cost":19.99,"event":"days_of_color"},
      {"item_id":"item_days_of_color_dark_rainbow_loafers","official_name_en":"Dark Rainbow Loafers","original_currency":"USD","original_cost":19.99,"event":"days_of_color"}
    ],
    "ticket_identity_items":[
      {"item_id":"item_days_of_nature_ocean_waves_outfit","official_name_en":"Ocean Waves outfit","original_currency":"event_currency","original_cost":"unknown","event":"days_of_nature"},
      {"item_id":"item_days_of_nature_ocean_manta_hair","official_name_en":"Ocean Manta hair","original_currency":"event_currency","original_cost":"unknown","event":"days_of_nature"},
      {"item_id":"item_days_of_color_rainbow_smock","official_name_en":"Rainbow Smock","original_currency":"event_currency","original_cost":"unknown","event":"days_of_color"},
      {"item_id":"item_days_of_color_rainbow_head_wrap","official_name_en":"Rainbow Head Wrap","original_currency":"event_currency","original_cost":"unknown","event":"days_of_color"}
    ]
  },
  "non_claims":[
    "The stated durations permit derived end-date calculations but do not assert an official exact end date in this snapshot.",
    "This historical FAQ does not establish current availability, a return policy, permanent-account property, or current storefront state.",
    "The FAQ does not provide formal Traditional Chinese names, image assets, a visual match, first release dates, or set membership.",
    "Ocean Waves Mask is excluded because the pinned vendor snapshot does not supply an exact identity match; all packs and bundles are excluded.",
    "The four event-ticket entries establish only event-currency basis and identity. They do not establish individual ticket prices."
  ]
}
